Department,Sub_Department,Topic,question_name,question_url,question_answer
Office of the General Counsel and Board Secretariat,Privacy,FIPPA,Q1: What do I do if I suspect a privacy breach?,https://www.torontomu.ca/gcbs/what-we-do/access-privacy/resources/fippa-faqs/#accordion-content-1507752320656-q1--what-do-i-do-if-i-suspect-a-privacy-breach-,"A: Toronto Metropolitan University (""TMU"") has a privacy incident notification process."
Office of the General Counsel and Board Secretariat,Privacy,FIPPA,Q2: What IS FIPPA and what are its fundamental principles?,https://www.torontomu.ca/gcbs/what-we-do/access-privacy/resources/fippa-faqs/#accordion-content-1507752321629-q2--what-is-fippa-and-what-are-its-fundamental-principles-,"FIPPA is provincial legislation that has applied to Ontario universities, including Toronto Metropolitan University (""TMU"") since June 10, 2006. FIPPA is composed of two principles of equal weight:  

Transparency: Access to information is an essential value
Privacy: Personal information and privacy must be protected and doing so is integral to the dignity and the integrity of the individual
FIPPA applies to any records in TMU's custody or control. Certain records are excluded from FIPPA including:

Private donations to TMU's archives
Labour relations and employment-related records leading to agreements
Research and teaching materials
Records not in the custody or control of TMU
There are specific exemptions to the obligation to disclose records, for example:

Personal information
Closed meetings
Solicitor-client documents
Economic and other interests of TMU
Third-party information
Advice and recommendations
Danger to health and safety
Publicly-available documents
Law enforcement
Relations with governments
FIPPA contains particular requirements for the collection, use, protection and disclosure of personal information.  Individuals have the right to ask for your own personal information and to request a correction of records containing your own personal information."
Office of the General Counsel and Board Secretariat,Privacy,FIPPA,Q3: Are there any general guiding principles that will help me make appropriate decisions when it comes to freedom of information and privacy?,https://www.torontomu.ca/gcbs/what-we-do/access-privacy/resources/fippa-faqs/#accordion-content-1507752322689-q3--are-there-any-general-guiding-principles-that-will-help-me-make-appropriate-decisions-when-it-comes-to-freedom-of-information-and-privacy-,"FIPPA requires that personal information and privacy must be protected 
When it comes to creating records (including email and paper documents) consider the possibility that what you are writing could be subject to an access request and therefore could be made publicówhat would the impact be on your reputation or TMUís? 
When someone asks you for another personís information, consider whether it is personal information, and if so, donít provide it. 
When you are using, storing, duplicating or destroying personal information, take reasonable steps to secure the information, e.g. password protect, locked file cabinets, confidential shredding, personal and confidential envelopes rather than email, not leaving documents sitting out on a desk where unauthorized people might have access. 
Review your files and emails regularly. If you have documents that you donít need and are under no policy or legal obligation to keep, then destroy them. 
Use common sense and good judgment. If you have specific questions ask your Chair or email the Privacy Officer."
Office of the General Counsel and Board Secretariat,Privacy,FIPPA,Q4: What are some best practices I can follow to minimize security and privacy breaches?,https://www.torontomu.ca/gcbs/what-we-do/access-privacy/resources/fippa-faqs/#accordion-content-1507752323508-q4--what-are-some-best-practices-i-can-follow-to-minimize-security-and-privacy-breaches-," Take the following actions:
Review employee procedures in the Information Protection and Access Policy for Restricted Information
Take Information Security Awareness Training 
If you are collecting, using, and/or storing other individualsí personal information (i.e. students or research subjects)
Always use password-protection 
Password protect your laptop and do not store data on the local drive, use a secure shared drive.
Be extra careful when sharing personal information via email ñ make sure the address is correct and include only the minimal information necessary to complete the task."
Office of the General Counsel and Board Secretariat,Privacy,FIPPA,"Q5: I've lost my laptop and it contained student records, my lectures and some research. What do I do?",https://www.torontomu.ca/gcbs/what-we-do/access-privacy/resources/fippa-faqs/#accordion-content-1507752367992-q5--i-ve-lost-my-laptop-and-it-contained-student-records--my-lectures-and-some-research--what-do-i-do-,"A:    Call security to report at 416.979.5040.  Tell them if your computer contained personal information on the hard drive, whether the machine was password protected and whether the data was encrypted.  

If there was data on the machine that consists of personal information (student grades, assignments, employee records, research containing other individualsí personal information) you are required by university policy to contact the Privacy Officer immediately at fippa@torontomu.ca.  This is a suspected privacy breach.

If the machine was password protected and the personal information data was encrypted this is not a breach and no further action is required.  If you did not use these precautions then you will be involved in notifying all affected individuals about the breach."
Office of the General Counsel and Board Secretariat,Privacy,FIPPA,Q6: Who is responsible when material intended for shredding is involved in a privacy breach?,https://www.torontomu.ca/gcbs/what-we-do/access-privacy/resources/fippa-faqs/#accordion-content-1507752368789-q6--who-is-responsible-when-material-intended-for-shredding-is-involved-in-a-privacy-breach-,"If you are the source, user, or keeper of the record then you are responsible for ensuring the informationís secure return or destruction once you are finished with it ñ think ìcradle to graveî responsibility.

talk to your department to find out about access to a shredder or to arrange for shredding of confidential records through Campus Facilities."
Office of the General Counsel and Board Secretariat,Privacy,FIPPA,Q7: What should I do if I am asked to provide information that I believe is protected under FIPPA?,https://www.torontomu.ca/gcbs/what-we-do/access-privacy/resources/fippa-faqs/#accordion-content-1507752369555-q7--what-should-i-do-if-i-am-asked-to-provide-information-that-i-believe-is-protected-under-fippa-,"A: In general, if you are asked for information that you would normally provide, such as a course syllabus or outline, a reading list, or a copy of an article you should provide that information. You must also provide information that is about the requestor, such as grades on tests and papers. You should not provide a third party with any personal information. You also do not need to provide such things as exam questions, teaching materials or research notes, as these are excluded. If you have a question you may contact TMU‚Äôs Privacy Officer at fippa@torontomu.ca. If you choose not to honour a request for information, the requestor has a right to file a Freedom of Information request. In the latter case, it will be TMU's Privacy Officer, who determines access to the information."
Office of the General Counsel and Board Secretariat,Privacy,FIPPA,Q8: What happens when TMU receives a request under FIPPA for access to information?,https://www.torontomu.ca/gcbs/what-we-do/access-privacy/resources/fippa-faqs/#accordion-content-1507752371974-q8--what-happens-when-tmu-receives-a-request-under-fippa-for-access-to-information-,"A: An access request must be made to TMU's Privacy Officer and requires a $5.00 application fee. The Privacy Officer determines where the requested information is held and will work with the FIPPA contact in that area to find the records requested and to determine if any exclusions or exemptions apply. Fees are charged to the requestor for the time taken to search for and, if appropriate, prepare records for release. If the information is to be given to the requestor, the Privacy Officer redacts any personal information, or other excluded information from the record before it is disclosed."
Office of the General Counsel and Board Secretariat,Privacy,FIPPA,Q9: Can someone use FIPPA to access my professional records created as part of consulting work I do outside my regular employment with the University?,https://www.torontomu.ca/gcbs/what-we-do/access-privacy/resources/fippa-faqs/#accordion-content-1507752372718-q9--can-someone-use-fippa-to-access-my-professional-records-created-as-part-of-consulting-work-i-do-outside-my-regular-employment-with-the-university-,"A: FIPPA applies to records that are in the custody and control of the University. It should not apply to records that are personal to you (including business activities unrelated to the University). However, if you don‚Äôt keep those records separate from your University records, it is possible that confusion could occur as to what is actually the University‚Äôs and what is yours. A best practice is to keep these separate and clearly mark those files that do not belong to the University (e.g. separate file cabinet, separate folders on computer and email)."
Office of the General Counsel and Board Secretariat,Privacy,FIPPA,Q10: What types of student and general records do I need to retain and for how long?,https://www.torontomu.ca/gcbs/what-we-do/access-privacy/resources/fippa-faqs/#accordion-content-1507752431381-q10--what-types-of-student-and-general-records-do-i-need-to-retain-and-for-how-long-,"Transitory Records
The following are considered to be transitory records that can and should be disposed of when no longer needed:
Duplicate stocks of publications, printed literature or blank forms, including those associated with computer-based information systems;
Duplicate records within the same media retained solely for convenient reference or future distribution (examples include branch-wide memos; ""All Staff"" e-mails; notices of holidays, special events or routine administrative matters; and personal desk copies of such items as program studies or committee minutes);
Broadly distributed materials (such as manuals, directives, bulletins and guidelines) used to communicate policies and practices for internal administration (other than original copies kept by the office from which the materials were issued);
Phone messages, personal messages, and records documenting activities such as holiday parties or charitable fund drives unconnected to program functions;
Unsolicited advertising materials;
Publications such as books, journals, magazines, newspapers, newsletters, and published reports which form or will form part of a library's catalogued holdings or are stored within branch libraries or reference shelves;
Publication extracts which have no significant value in documenting how program data was collected or decisions reached, and which have not therefore been integrated within program files;
Temporary working papers such as rough notes or informal drafts that are of no value in documenting data collection or in showing how TMU policies or programs were developed or implemented. (That is, they represent no significant steps in the preparation of a final document, were not reviewed by other persons, do not record program decisions, and do not contain important research or background data.)
Managers should ensure that all transitory items are deleted or destroyed immediately when no longer needed.

Official TMU Records
Official records are distinct from transitory records. Official records serve important business functions, such as supporting program delivery or policy development, or meeting legal, financial and other needs. They may also provide important evidence of institutional decisions and actions. These should only be destroyed in accordance with with TMUís Record Retention Schedule (see Records Management Policy).

Records Containing Personal Information
Anything which has personal information must be retained for a minimum of one year under FIPPA. Personal information includes, but is not limited to: name, home address, home phone number, studentís email address (home or TMU), identifying numbers (e.g. student number, employee number or social insurance number), education history (grades, degrees received, academic misconduct) health history, or opinions about an individual.  Your professional contact information is generally not perceived as personal information (facultyís business phone number, TMU email, business mailing address). See the definition of ìpersonal informationî in the Freedom of Information and Protection of Privacy Act available on the General Counselís Information Access and Privacy website.  

According to TMU's Course Management Policy 166, all student work is to be returned to the student before the end of the academic term.  Final exams and unclaimed assignments are the only type of student work that, under FIPPA, will need to be retained for the one-year period because these are not returned to students.  

You should also retain all documents and correspondence that may be part of the academic or academic conduct appeals process. You are required by the Course Management Policy to submit a copy of your grade sheet to the Department/School."
Office of the General Counsel and Board Secretariat,Privacy,FIPPA,Q11: What should be my e-mail protocol and retention in regard to correspondence with students?,https://www.torontomu.ca/gcbs/what-we-do/access-privacy/resources/fippa-faqs/#accordion-content-1507752432496-q11--what-should-be-my-e-mail-protocol-and-retention-in-regard-to-correspondence-with-students-,"You should be careful about the content of e-mails as they may be retained not only by you but by others, and they can be requested as part of an FOI request. Generally, the ‚Äúreply all‚Äù response should be avoided unless it is necessary. You can never be assured of what is retained by others; so, even if you have deleted an email, that‚Äôs no guarantee it will not end up being released as a result of an FOI request."
Office of the General Counsel and Board Secretariat,Privacy,FIPPA,Q12: Can I send multiple students one email using their TMU email address and what are other methods of communication I can use to communicate with groups of students?,https://www.torontomu.ca/gcbs/what-we-do/access-privacy/resources/fippa-faqs/#accordion-content-1507752433871-q12--can-i-send-multiple-students-one-email-using-their-tmu-email-address-and-what-are-other-methods-of-communication-i-can-use-to-communicate-with-groups-of-students-," A TMU studentís email address is considered their personal information and as such faculty should take care in the use of these addresses. 

All students are provided with an official TMU email address, as per Senate Policy #157, Establishment of Student Email Accounts for Official University Communication, as a means by which Ryerson employees can communicate with students.  The address is also a means by which TMU can foster a collaborative learning environment such as through student discussion groups on D2L Brightspace.  There are no restrictions on how students can use their email address, such as for personal communications, or for communications outside TMU. 

Faculty and staff, however, should take care in using student email addresses.  Be cautious in sending group emails; disclosing personal information such as grades, internship placements, home contact information, or details about an academic appeal to other students as these situations would all constitute a privacy breach and TMU's Privacy Officer must be notified immediately. 

If you want to send a group email and the text does not identify individuals, consider using the blind-copying function. Refrain from disclosing the studentís email address to non-TMU personnel unless you have the consent of the student.  

Using D2L Brightspace to post general information messages to students is one low-risk option.  For messages aimed at a specific group of students within a course try using the blind-copying function on your email system; this way students can only see their own address and cannot see who else received the message.  It is important to note that the content of the message should dictate the method used to communicate information to students; the more sensitive the information, the less appropriate group communication, including email will be."
Office of the General Counsel and Board Secretariat,Privacy,FIPPA,Q13: What should be my e-mail protocol and retention in regard to correspondence with other faculty and administration?,https://www.torontomu.ca/gcbs/what-we-do/access-privacy/resources/fippa-faqs/#accordion-content-1507752434777-q13--what-should-be-my-e-mail-protocol-and-retention-in-regard-to-correspondence-with-other-faculty-and-administration-,"All emails from and to students that contain personal information as described above and that you use for the purpose of evaluating their contributions during a course or for advising regarding their educational path should be retained for one year under FIPPA.  Particular emphasis is placed upon retaining correspondence that reveals something personal about the student beyond their email address (student ID, educational or medical history, financial information, questions about course work, evaluations, etc.).  This also includes any correspondence that may pertain to an appeal.  You should only correspond with students on their ìryerson.caî email accounts as per TMUís policy for the Establishment of Student Email Accounts for Official University Communication 157.

You should be careful about the content of e-mails as they may be retained not only by you but by others, and they can be requested as part of an FOI request. Generally, the ìreply allî response should be avoided unless it is necessary. You can never be assured of what is retained by others; so, even if you have deleted an email, thatís no guarantee it will not end up being released as a result of an FOI request."
Office of the General Counsel and Board Secretariat,Privacy,FIPPA,Q14: Am I entitled to access to students‚Äô academic records for any reason?,https://www.torontomu.ca/gcbs/what-we-do/access-privacy/resources/fippa-faqs/#accordion-content-1507752476505-q14--am-i-entitled-to-access-to-students--academic-records-for-any-reason-,"A: In general, you do not have the right to consult a student‚Äôs academic record. Faculty who serve on appeals panels or who are charged with academic advising may confidentially access these records for that purpose only. Chairs/Directors and their specified administrative staff may access records for administrative purposes only and are not authorized to share that record with faculty. If you have questions regarding whether you may access an academic record for a particular purpose speak to the Associate Registrar, Enrollment Services."
Office of the General Counsel and Board Secretariat,Privacy,FIPPA,Q15: What should I do with unclaimed students‚Äô work?,https://www.torontomu.ca/gcbs/what-we-do/access-privacy/resources/fippa-faqs/#accordion-content-1507752477247-q15--what-should-i-do-with-unclaimed-students--work-,"A: The Course Management Policy states that students‚Äô work must be returned to them confidentially. Putting student work in a box outside your office is not permitted. Departments/Schools are required to develop policies on the confidential disposal of work. Under FIPPA you must retain all unclaimed student work, including final exams, for one year from the date received. Student grades and evaluation comments should be kept confidential. It is advisable not to put the mark and comments on the front page of the document."
Office of the General Counsel and Board Secretariat,Privacy,FIPPA,Q16: Can I have students working in groups hand in one assignment together with their names and their TMU Student Identification Numbers on the first page?,https://www.torontomu.ca/gcbs/what-we-do/access-privacy/resources/fippa-faqs/#accordion-content-1507752478600-q16--can-i-have-students-working-in-groups-hand-in-one-assignment-together-with-their-names-and-their-tmu-student-identification-numbers-on-the-first-page-,"A: The concern is that name plus student ID number permits someone else with enough information to impersonate another student. The more information disclosed, the better able some one would be in committing fraud. A similar approach to that outlined in the Course Management Policy Section 2.2(f) should be followed where only part of the student number is included. It is recommended that the last 4 digits be used. In other words, professors can request that students working on group assignments hand in projects listing a portion of the student ID number and no names. In this way the other students in the group will not be privy to the entire student ID number."
Office of the General Counsel and Board Secretariat,Privacy,FIPPA,Q17: How can I now take students‚Äô attendance at weekly classes and final exams? What if the student doesn‚Äôt have their OneCard?,https://www.torontomu.ca/gcbs/what-we-do/access-privacy/resources/fippa-faqs/#accordion-content-1507752479350-q17--how-can-i-now-take-students--attendance-at-weekly-classes-and-final-exams--what-if-the-student-doesn-t-have-their-onecard-," Attendance at lectures, seminars and labs can still be taken, but professors should be sensitive to how this information is gathered. The studentís full name and complete student ID number should not be circulated. 

For final exams, invigilators should walk around the room to verify student photo ID cards on a student-by-student basis, noting the attendance on a sheet of names and numbers, and students should sign their individual exams.   

According to the Senateís Examination Policy 135, Section III (B)(5) students must present relevant photo identification; the policy does not specify that only the OneCard will suffice.  There is no need to take a studentís photograph at an exam.  It is the studentís responsibility to ensure that he/she brings proper identification.  If a student does not have any photo ID, the instructor should first try to confirm that the student is in the class, and the student should be required to bring identification with a signature to the instructorís office as soon as possible after the exam."
Office of the General Counsel and Board Secretariat,Privacy,FIPPA,"Q18: What can an instructor do upon becoming aware that a student is taking photos or video of the lecture, other students, or discussion period? Is this a violation of student privacy? What about the instructors‚Äô privacy?",https://www.torontomu.ca/gcbs/what-we-do/access-privacy/resources/fippa-faqs/#accordion-content-1507752480952-q18--what-can-an-instructor-do-upon-becoming-aware-that-a-student-is-taking-photos-or-video-of-the-lecture--other-students--or-discussion-period--is-this-a-violation-of-student-privacy--what-about-the-instructors--privacy-,"Studentsí answers, student images ñ these are the personal information of students.  The actual lecture is the teaching material of the instructor and is not meant to be publicly available without his/her consent; teaching materials are protected against disclosure from a formal access request under FIPPA.  The image of the instructor is his/her personal information therefore both the instructorís lecture and image would require the instructorís consent for capture.

If notice about the intent to capture the lecture by audio or visual recording is provided in advance to the instructor and students, no oneís privacy would be violated.  Students with concerns could approach the instructor in advance.  If the request to record the lecture stems from an Access Centre request, then these concerns would be relayed to the Access Centre.  TMU is obliged under the Ontario Human Rights Code and the Accessibility for Ontarians with Disabilities Act (Bill 118) to seek a reasonable accommodation so that students with disabilities are not at a learning disadvantage.  Please contact the Access Centre for further information (ext. 5290).  See also the Senate policy Academic Accomodation of Students with Disabilities 159"
Office of the General Counsel and Board Secretariat,Privacy,FIPPA,"Q19: In award ceremonies where donors recognize student achievements, how do we protect student privacy? Do we need students‚Äô consent to disclose personal information about them to the donor? Photos? Announcements? Newsletters? What if the donor wants to take the information and publish it elsewhere?",https://www.torontomu.ca/gcbs/what-we-do/access-privacy/resources/fippa-faqs/#accordion-content-1507752523982-q19--in-award-ceremonies-where-donors-recognize-student-achievements--how-do-we-protect-student-privacy--do-we-need-students--consent-to-disclose-personal-information-about-them-to-the-donor--photos--announcements--newsletters--what-if-the-donor-wants-to-take-the-information-and-publish-it-elsewhere-,"For awards applied through TMUís Student Financial Assistance as of April 2008 there is a notice of collection in place that covers this use. 

For all other awards, or other kinds of student achievements, departments are advised to contact students in advance to obtain their permission to use their personal information."
